ecoregion,scientific_name,common_name,class,conservation_status,habitat_type,image_url,attribution,description
Amazon and Guianas,Jaguar,Jaguar,MAMMALIA,NT,Lowland rainforest,https://upload.wikimedia.org/wikipedia/commons/0/0a/Standing_jaguar.jpg,Wikimedia Commons,"The jaguar is a large cat species and the only living member of the genus Panthera that is native to the Americas. With a body length of up to 1.85 m and a weight of up to 158 kg (348 lb), it is the biggest cat species in the Americas and the third largest in the world. Its distinctively marked coat features pale yellow to tan colored fur covered by spots that transition to rosettes on the sides, although a melanistic black coat appears in some individuals. The jaguar's powerful bite allows it to pierce the carapaces of turtles and tortoises, and to employ an unusual killing method: it bites directly through the skull of mammalian prey between the ears to deliver a fatal blow to the brain."
Amazon and Guianas,Harpy eagle,Harpy eagle,AVES,NT,Canopy rainforest,https://upload.wikimedia.org/wikipedia/commons/3/3b/Harpia_harpyja_001_800.jpg,Wikimedia Commons,"The harpy eagle is a large neotropical species of eagle. It is also called the American harpy eagle to distinguish it from the Papuan eagle, which is sometimes known as the New Guinea harpy eagle or Papuan harpy eagle. It is the largest bird of prey throughout its range, and among the largest extant species of eagles in the world. It usually inhabits tropical lowland rainforests in the upper (emergent) canopy layer. Destruction of its natural habitat has caused it to vanish from many parts of its former range, and it is nearly extirpated from much of Central America. It is the only member of the genus Harpia, which, together with Harpyopsis, Macheiramphus and Morphnus, forms the subfamily Harpiinae."
Amazon and Guianas,Amazon river dolphin,Amazon river dolphin,MAMMALIA,VU,Amazon River,https://upload.wikimedia.org/wikipedia/commons/9/99/Amazonas-Flussdelfin_Orinoko3.jpg,Wikimedia Commons,"The Amazon river dolphin, also known as the boto, bufeo or pink river dolphin, is a species of toothed whale endemic to South America and is classified in the family Iniidae. Three subspecies are currently recognized: I. g. geoffrensis, I. g. boliviensis and I. g. humboldtiana. The position of the Araguaian river dolphin within the clade is still unclear. The three subspecies are distributed in the Amazon basin, the upper Madeira River in Bolivia, and the Orinoco basin, respectively."
Amazon and Guianas,Giant otter,Giant otter,MAMMALIA,VU,River floodplains,https://upload.wikimedia.org/wikipedia/commons/2/21/Giant_otters_%28Pteronura_brasiliensis%29.jpg,Wikimedia Commons,"The giant otter or giant river otter is a South American carnivorous mammal. It is the longest member of the weasel family, Mustelidae, a globally successful group of predators, reaching up to 1.8 m. Atypical of mustelids, the giant otter is a social species, with family groups typically supporting three to eight members. The groups are centered on a dominant breeding pair and are extremely cohesive and cooperative. Although generally peaceful, the species is territorial, and aggression has been observed between groups. The giant otter is diurnal, being active exclusively during daylight hours. It is the noisiest otter species, and distinct vocalizations have been documented that indicate alarm, aggression, and reassurance."
Amazon and Guianas,Black caiman,Black caiman,REPTILIA,NT,Freshwater wetlands,https://upload.wikimedia.org/wikipedia/commons/7/72/Melanosuchus_niger_in_Moscow_zoo.jpg,Wikimedia Commons,"The black caiman is a crocodilian reptile endemic to South America. With a maximum length of around 5 to 6.5 m and a mass of over 450 kg (1,000 lb), it is the largest living species of the family Alligatoridae, and the third-largest crocodilian in the Neotropical realm. True to its common and scientific names, the black caiman has a dark greenish-black coloration as an adult. In some individuals, the pigmentation can appear almost jet-black. It has grey to brown banding on the lower jaw; juveniles have a more vibrant coloration compared to adults, with prominent white-pale yellow banding on the flanks that remains present well into adulthood. The banding on young helps with camouflage by breaking up their body outline, on land or in water, in an effort to avoid predation. The morphology is quite different from other caimans but the bony ridge that occurs in other caimans is present. The head is large and heavy, an advantage in catching larger prey. Like all crocodilians, caimans are long, squat creatures, with big jaws, long tails and short legs. They have thick, scaled skin, and their eyes and noses are located on the tops of their heads. This enables them to see and breathe while the rest of their bodies are underwater."
Amazon and Guianas,Green anaconda,Green anaconda,REPTILIA,LC,Flooded forests,https://upload.wikimedia.org/wikipedia/commons/b/b4/Sucuri_verde.jpg,Wikimedia Commons,"The green anaconda, also known as the giant anaconda, emerald anaconda, common anaconda, common water boa, northern green anaconda, or akayima, is a semi-aquatic boa species found in South America and the Caribbean island of Trinidad. It is the largest, heaviest, and one of the longest snakes in the world. Like all boas, it is a non-venomous constrictor.
The term ""anaconda"" often refers to this species, though the term could also apply to other members of the genus Eunectes. Fossils of the snake date back to the Late Pleistocene in the Gruta do Urso locality."
Amazon and Guianas,Scarlet macaw,Scarlet macaw,AVES,LC,Rainforest canopy,https://upload.wikimedia.org/wikipedia/commons/4/47/Scarlet_macaw_%28Ara_macao_cyanopterus%29_Copan.jpg,Wikimedia Commons,"The scarlet macaw also called the red-and-yellow macaw, red-and-blue macaw or red-breasted macaw, is a large yellow, red and blue Neotropical parrot native to humid evergreen forests of the Americas. Its range extends from southeastern Mexico to Peru, Ecuador, Colombia, Bolivia, Venezuela, Honduras, and Brazil in lowlands of 500 m (1,600 ft) up to 1,000 m (3,300 ft), the Caribbean island of Trinidad, as well as the Pacific island of Coiba. Formerly, the northern extent of its range included southern Tamaulipas. In some areas, it has suffered local extinction because of habitat destruction, or capture for the parrot trade, but in other areas, it remains fairly common. It is the national bird of Honduras. Like its relative the blue-and-yellow macaw, the scarlet macaw is a popular bird in aviculture as a result of its striking plumage. It is the third most common macaw species in captivity after the blue-and-yellow and red-and-green macaw respectively. In recent years it has become much rarer in captivity and much more expensive due to stricter laws, its price being higher than even red-and-green macaws."
Amazon and Guianas,Blue-and-yellow macaw,Blue-and-yellow macaw,AVES,LC,Rainforest canopy,https://upload.wikimedia.org/wikipedia/commons/e/ec/Ara_ararauna_Luc_Viatour.jpg,Wikimedia Commons,"The blue-and-yellow macaw, also known as the blue-and-gold macaw, is a large Neotropical parrot with a mostly blue dorsum, light yellow/orange venter, and gradient hues of green on top of its head. It is a member of the large group of neotropical parrots known as macaws. It inhabits forest, woodland and savannah of tropical Central and South America, as well as the island of Trinidad in the Caribbean. They are popular in aviculture because of their striking color, ability to talk, ready availability in the marketplace, and close bonding to humans. It is the most commonly kept macaw species in captivity worldwide as a pet or companion parrot and is also the cheapest among the large macaws. As of 2025, there are 1 million blue and gold macaws living in captivity worldwide, one of the highest population of any large parrot in captivity, such is the popularity of this bird."
Amazon and Guianas,Red-bellied piranha,Red-bellied piranha,ACTINOPTERYGII,LC,Rivers and lakes,https://upload.wikimedia.org/wikipedia/commons/c/c7/Pygocentrus_nattereri_-_Karlsruhe_Zoo_01.jpg,Wikimedia Commons,"The red-bellied piranha, also known as the red piranha, is a species of freshwater ray-finned fish belonging to the family Serrasalmidae, which includes the pacus, piranhas and related fishes. The red-bellied piranha occurs in South America, found in the Amazon, Paraguay, Paraná and Essequibo basins, as well as coastal rivers of northeastern Brazil. This fish is locally abundant in its freshwater habitat."
Amazon and Guianas,Arapaima,Arapaima,ACTINOPTERYGII,VU,Floodplain lakes,https://upload.wikimedia.org/wikipedia/commons/e/e8/Arapaima_gigas_at_Beijing_aquarium.JPG,Wikimedia Commons,"The arapaima, pirarucu, or paiche is any large species of bonytongue in the genus Arapaima native to the Amazon and Essequibo basins of South America. Arapaima is the type genus of the subfamily Arapaiminae within the family Osteoglossidae. They are among the world's largest freshwater fish, reaching as much as 3 m (9.8 ft) in length. They are an important food fish. They have declined in the native range due to overfishing and habitat loss. In contrast, arapaima have been introduced to several tropical regions outside the native range, where they are sometimes considered invasive species. In Kerala, India, arapaima escaped from aquaculture ponds after floods in 2018. Its Portuguese name, pirarucu, derives from the Tupi language words pira and urucum, meaning ""red fish""."
Amazon and Guianas,Electric eel,Electric eel,ACTINOPTERYGII,LC,Lowland rivers,https://upload.wikimedia.org/wikipedia/commons/8/8f/Electric-eel.jpg,Wikimedia Commons,"The electric eels are a genus, Electrophorus, of neotropical freshwater fish from South America in the family Gymnotidae, of which they are the only members of the subfamily Electrophorinae. They are known for their ability to stun their prey by generating electricity, delivering shocks at up to 860 volts. Their electrical capabilities were first studied in 1775, contributing to the invention of the electric battery in 1800."
Amazon and Guianas,Pygmy marmoset,Pygmy marmoset,MAMMALIA,LC,River-edge forests,https://upload.wikimedia.org/wikipedia/commons/b/b7/Dv%C3%A6rgsilkeabe_Callithrix_pygmaea.jpg,Wikimedia Commons,"Pygmy marmosets are two species of small New World monkeys in the genus Cebuella. They are native to rainforests of the western Amazon Basin in South America. These primates are notable for being the smallest monkeys in the world, at just over 100 g (3.5 oz). They are generally found in evergreen and river-edge forests and are gum-feeding specialists, or gummivores."
Amazon and Guianas,Red howler monkey,Red howler monkey,MAMMALIA,LC,Rainforest canopy,,,
Amazon and Guianas,White-bellied spider monkey,White-bellied spider monkey,MAMMALIA,EN,Rainforest canopy,https://upload.wikimedia.org/wikipedia/commons/e/e4/Ateles_belzebuth_belzebuth.jpg,Wikimedia Commons,"The white-bellied spider monkey, also known as the white-fronted or long-haired spider monkey, is an endangered species of spider monkey, a type of New World monkey. It is found in the north-western Amazon in Colombia, Ecuador, Venezuela, Peru and Brazil, ranging as far south as the lower Ucayali River and as far east as the Branco River. In the past, the Peruvian, brown and white-cheeked spider monkeys have been treated as subspecies of A. belzebuth. As presently defined, the white-bellied spider monkey is monotypic. It has a whitish belly and a pale patch on the forehead, which, despite its common name, often is orange-buff, though this might be due to dirt and other stainers. They live in groups of 20 to 40 individuals, splitting into small parties of 1 to 9 when in activity."
Amazon and Guianas,Capybara,Capybara,MAMMALIA,LC,Riparian grasslands,https://upload.wikimedia.org/wikipedia/commons/3/34/Hydrochoeris_hydrochaeris_in_Brazil_in_Petr%C3%B3polis%2C_Rio_de_Janeiro%2C_Brazil_09.jpg,Wikimedia Commons,"The capybara or greater capybara is the largest living rodent, native to South America. It is a member of the genus Hydrochoerus. Its close relatives include
guinea pigs and rock cavies, and it is more distantly related to the agouti, the chinchilla, and the nutria. The capybara inhabits savannas and dense forests, and lives near bodies of water. It is a highly social species and can be found in groups as large as one hundred individuals, but usually live in groups of 10–20 individuals. The capybara is hunted for its meat and hide and also for grease from its thick fatty skin."
Amazon and Guianas,South American tapir,South American tapir,MAMMALIA,VU,Flooded forests,https://upload.wikimedia.org/wikipedia/commons/3/36/South_American_tapir_%28Tapirus_terrestris%29.JPG,Wikimedia Commons,"The South American tapir, also commonly called the Brazilian tapir, the Amazonian tapir, the maned tapir, the lowland tapir, anta, and la sachavaca, is one of the four recognized species in the tapir family. It is the largest surviving native terrestrial mammal in the Amazon."
Amazon and Guianas,Giant anteater,Giant anteater,MAMMALIA,NT,Rainforest edges,https://upload.wikimedia.org/wikipedia/commons/3/3b/Myresluger2.jpg,Wikimedia Commons,"The giant anteater is an insectivorous mammal native to Central and South America. It is the largest of the four living species of anteaters, which are classified with sloths in the order Pilosa. The only extant member of the genus Myrmecophaga, the giant anteater is mostly terrestrial, in contrast to other living anteaters and sloths, which are arboreal or semiarboreal. The species is 182 to 217 cm in length, with weights of 33 to 50 kg for males and 27 to 47 kg for females. It is recognizable by its elongated snout, bushy tail, long foreclaws, and distinctively colored fur."
Amazon and Guianas,Brown-throated sloth,Brown-throated sloth,MAMMALIA,LC,Rainforest canopy,https://upload.wikimedia.org/wikipedia/commons/1/18/Bradypus.jpg,Wikimedia Commons,The brown-throated sloth is a species of three-toed sloth found in the Neotropical realm of Central and South America.
Amazon and Guianas,Hoatzin,Hoatzin,AVES,NT,Riparian forests,https://upload.wikimedia.org/wikipedia/commons/5/54/Hoatzin_%28Opisthocomus_hoazin%29_Rio_Napo.jpg,Wikimedia Commons,"The hoatzin or hoactzin is a species of tropical bird found in swamps, riparian forests, and mangroves of the Amazon and the Orinoco basins in South America. It is the only extant species in the genus Opisthocomus which is the only extant genus in the Opisthocomidae family under the order of Opisthocomiformes. Despite being the subject of intense debate by specialists, the taxonomic position of this family is still far from clear."
Amazon and Guianas,Spectacled caiman,Spectacled caiman,REPTILIA,LC,Freshwater wetlands,https://upload.wikimedia.org/wikipedia/commons/d/df/Caiman_crocodilus_llanos.JPG,Wikimedia Commons,"The spectacled caiman, also known as the white caiman, common caiman, and speckled caiman, is a crocodilian in the family Alligatoridae. It is brownish-, greenish-, or yellowish-gray colored and has a spectacle-like ridge between its eyes, which is where its common name come from. It grows to a length of 1.4–2.5 m and a weight of 7–40 kg (15–88 lb), with males being both longer and heavier than females. Its diet varies seasonally, commonly consisting of crabs, fish, small mammals, amphibians and snails. Breeding occurs from May to August and 14–40 eggs are laid in July and August. This crocodilian has a large range and population; it is native to much of Latin America, and has been introduced to the United States, Cuba, and Puerto Rico."
Amazon and Guianas,Amazonian manatee,Amazonian manatee,MAMMALIA,VU,Floodplain lakes,https://upload.wikimedia.org/wikipedia/commons/4/49/Manati_amazonico_en_Iquitos.jpg,Wikimedia Commons,"The Amazonian manatee, commonly referred to as cowfish in Brazil, is a species of manatee that lives in the Amazon Basin in Brazil, Peru, Colombia and Ecuador. It has thin, wrinkled brownish or gray colored skin, with fine hairs scattered over its body and a white chest patch. It is the smallest of the three extant species of manatee."
Amazon and Guianas,Tucuxi,Tucuxi,MAMMALIA,VU,Freshwater rivers,https://upload.wikimedia.org/wikipedia/commons/9/9c/Sotalia_fluviatilis_Amazon_River_Dolphin.jpg,Wikimedia Commons,"The tucuxi, alternatively known in Peru bufeo gris or bufeo negro, is a species of freshwater dolphin found in the rivers of the Amazon basin. The word tucuxi is derived from the Tupi language word tuchuchi-ana, and has now been adopted as the species' common name. Despite being found in geographic locations similar to those of 'true' river dolphins such as the boto, the tucuxi is not closely related to them genetically. Instead, it is classed in the oceanic dolphin family (Delphinidae)."
Amazon and Guianas,Scolopendra gigantea,Amazonian giant centipede,INSECTA,DD,Rainforest floor,https://upload.wikimedia.org/wikipedia/commons/3/3b/Scolopendra_gigantea_%281%29.jpg,Wikimedia Commons,"Scolopendra gigantea, also known as the Peruvian giant yellow-leg centipede or Amazonian giant centipede, is a centipede in the genus Scolopendra. It is the largest centipede species in the world, with a length exceeding 30 centimetres (12 in). Specimens may have 21 or 23 segments. It is found in various places throughout South America and the extreme south Caribbean, where it preys on a wide variety of animals, including other sizable arthropods, amphibians, mammals and reptiles."
Amazon and Guianas,Blue poison dart frog,Blue poison dart frog,AMPHIBIA,LC,Rainforest floor,https://upload.wikimedia.org/wikipedia/commons/d/dd/Dendrobates_azureus_qtl1.jpg,Wikimedia Commons,"The blue poison dart frog or blue poison arrow frog is a poison dart frog found in the ""forest islands"" surrounded by the Sipaliwini Savanna in southern Suriname. Its indigenous Tiriyo name is okopipi. The name ""azureus"" comes from its azure blue color. While first described as a valid species and usually recognized as such in the past, recent authorities generally treat it as a morph of D. tinctorius, although a few treat it as a subspecies of D. tinctorius or continue to treat it as its own species. To what extent it differs from the blue D. tinctorius in southern Guyana, adjacent Pará (Brazil) and possibly far southwestern Suriname, is also a matter of dispute, and many herpetologists, as well as many people keeping poison dart frogs in captivity, have not distinguished these, with all commonly being identified as ""azureus""."
Amazon and Guianas,Amazon milk frog,Amazon milk frog,AMPHIBIA,LC,Rainforest canopy,https://upload.wikimedia.org/wikipedia/commons/f/f2/Phrynohyas_resinifictrix_Warsaw_Zoo_02.jpg,Wikimedia Commons,"The Mission golden-eyed tree frog or Amazon milk frog is a large species of arboreal frog native to the Amazon Rainforest in South America. It is sometimes referred to as the blue milk frog due to a sticky, milk-like substance that they produce when feeling threatened. It was first discovered along the Maracanã River in Brazil. This species was previously within the genus Phrynohyas, which was recently synonymized with Trachycephalus."
Amazon and Guianas,Lachesis muta,Bushmaster,REPTILIA,VU,Rainforest floor,https://upload.wikimedia.org/wikipedia/commons/5/5e/Lachesis_muta_muta.jpg,Wikimedia Commons,"Lachesis muta, also known as the Southern American bushmaster or Atlantic bushmaster, is a pit viper species found in South America, as well as the island of Trinidad in the Caribbean. Two subspecies are currently recognized, including the nominate subspecies described here."
Amazon and Guianas,Emperor tamarin,Emperor tamarin,MAMMALIA,NT,Várzea forests,https://upload.wikimedia.org/wikipedia/commons/5/55/Tamarin_portrait.JPG,Wikimedia Commons,"The emperor tamarin is a species of tamarin monkey allegedly named for its beard's resemblance to the German emperor Wilhelm II. It lives in the north Brazilian states of Acre and Amazonas and the southwest Amazon Basin, in east Peru, north Bolivia."
Amazon and Guianas,Common squirrel monkey,Common squirrel monkey,MAMMALIA,NT,Riverine forests,https://upload.wikimedia.org/wikipedia/commons/9/92/Mono_ardilla_-_Saimiri_sciureus.jpg,Wikimedia Commons,"Common squirrel monkey is the traditional common name for several small squirrel monkey species native to the tropical areas of South America. The term common squirrel monkey had been used as the common name for Saimiri sciureus before genetic research by Jessica Lynch Alfaro and others indicated S. scuireus covered at least three and possibly four species: the Guianan squirrel monkey, Humboldt's squirrel monkey and Collins' squirrel monkey. The Ecuadorian squirrel monkey, generally regarded as a subspecies of Humboldt's squirrel monkey, had also been sometimes proposed as a separate species that had originally been included within the term ""common squirrel monkey."""
Amazon and Guianas,Red-rumped agouti,Red-rumped agouti,MAMMALIA,LC,Forest floor,https://upload.wikimedia.org/wikipedia/commons/8/8f/Red-rumped_Agouti_%2817380318590%29.jpg,Wikimedia Commons,"The red-rumped agouti, also known as the golden-rumped agouti, orange-rumped agouti or Brazilian agouti, is a species of agouti from the family Dasyproctidae."
Amazon and Guianas,Lowland paca,Lowland paca,MAMMALIA,LC,Forest floor,https://upload.wikimedia.org/wikipedia/commons/3/36/Cuniculus_paca.jpg,Wikimedia Commons,"The lowland paca, also known as the spotted paca, is a large rodent found in tropical and sub-tropical America, from east-central Mexico to northern Argentina, and has been introduced to Cuba and Algeria."
Amazon and Guianas,Tayra,Tayra,MAMMALIA,LC,Forest interior,https://upload.wikimedia.org/wikipedia/commons/a/a5/Tayra_-_Male%2C_Brazil_%28cropped%29.jpg,Wikimedia Commons,"The tayra is an omnivorous animal from the mustelid family, native to the Americas. It is the only species in the genus Eira."
Amazon and Guianas,Goliath birdeater,Goliath birdeater,INSECTA,DD,Rainforest floor,https://upload.wikimedia.org/wikipedia/commons/f/fa/Theraphosa_blondi_MHNT.jpg,Wikimedia Commons,"The Goliath birdeater is a very large spider that belongs to the tarantula family Theraphosidae. Found in northern South America, it is the largest spider in the world by mass and body length, and second to the giant huntsman spider by leg span. It is also considerably longer than the largest known prehistoric spider, Mongolarachne, that had a body length of 2.46 centimeters (0.97 in). It is also called the Goliath tarantula or Goliath bird-eating spider; the practice of calling theraphosids ""bird-eating"" derives from an early 18th-century copper engraving by Maria Sibylla Merian that shows one eating a hummingbird. Despite the spider's name, it rarely preys on birds."
Amazon and Guianas,Leafcutter ant,Leafcutter ant,INSECTA,LC,Forest floor,https://upload.wikimedia.org/wikipedia/commons/5/5f/Atta_cephalotes-pjt.jpg,Wikimedia Commons,"Leafcutter ants are fungus-growing ants that share the behaviour of cutting leaves which they carry back to their nests to farm fungus. Next to humans, leafcutter ants form some of the largest and most complex animal societies on Earth. In a few years, the central mound of their underground nests can grow to more than 30 m (98 ft) across, with smaller radiating mounds extending out to a radius of 80 m (260 ft), taking up 30 to 600 m2 and occupied by 3.55 million individuals."
Amazon and Guianas,Morpho menelaus,Blue morpho butterfly,INSECTA,LC,Rainforest canopy,https://upload.wikimedia.org/wikipedia/commons/2/23/Morpho_menelaus_huebneri_MHNT_Male_Dos.jpg,Wikimedia Commons,"The Menelaus blue morpho is one of 30 species of butterfly in the subfamily Morphinae. Its wingspan is about 12 cm (4.7 in), and its dorsal forewings and hindwings are a bright, iridescent blue with black edges, while the ventral surfaces are brown. Its iridescent wings are an area of interest in research due to their unique nanostructure. Due to its characteristic blue color, Morpho menelaus is considered valuable among collectors and was widely hunted in the 20th century."
Amazon and Guianas,Heliconia rostrata,Hanging lobster claw,MAGNOLIOPSIDA,LC,Tropical understory,https://upload.wikimedia.org/wikipedia/commons/b/bb/Heliconia_rostrata_4.jpg,Wikimedia Commons,"Heliconia rostrata, the hanging lobster claw or false bird of paradise, is a herbaceous perennial plant native to El Salvador, Peru, Bolivia, Colombia, Venezuela, Costa Rica, and Ecuador, and naturalized in Puerto Rico. It is found in tropical rainforests, as it thrives in warm and humid environments.The inflorescences of many other heliconias grow vertically, facing upwards, their cup-shaped bracts storing water for birds and insects. This plant, however, has pendulous inflorescences with the bracts facing downwards, the flowers nestled underneath. Without the collection of rainwater in the bracts, the flowers within them provide a source of undiluted nectar."
Amazon and Guianas,Victoria amazonica,Unknown,MAGNOLIOPSIDA,LC,Flooded oxbow lakes,https://upload.wikimedia.org/wikipedia/commons/b/b4/Victoria_amazonica_edit_1.jpg,Wikimedia Commons,"Victoria amazonica is a species of flowering plant, the second largest in the water lily family Nymphaeaceae. It is called Vitória-Régia or Iaupê-Jaçanã in Brazil and Atun Sisac in Inca (Quechua). Its native region is tropical South America, specifically Guyana and the Amazon Basin."
