ecoregion,scientific_name,common_name,class,conservation_status,habitat_type,image_url,attribution,description
Coral Triangle,Whale shark,Whale shark,CHONDRICHTHYES,EN,Pelagic marine waters,https://upload.wikimedia.org/wikipedia/commons/f/f6/Similan_Dive_Center_-_great_whale_shark.jpg,Wikimedia Commons,"The whale shark is a slow-moving, filter-feeding carpet shark and the largest known extant fish species. The largest confirmed individual had a length of 18.8 m (61.7 ft). The whale shark holds many records for size in the animal kingdom, most notably being by far the most massive living non-cetacean animal. It is the only living species of the genus Rhincodon and the only extant member of the family Rhincodontidae, which belongs to the subclass Elasmobranchii in the class Chondrichthyes. Before 1984 it was classified as Rhiniodon into Rhinodontidae. An extinct species, Rhincodon ferriolensis was describried in Europe, in Late Burdigalian stage."
Coral Triangle,Green sea turtle,Green sea turtle,REPTILIA,EN,Seagrass meadows and reefs,https://upload.wikimedia.org/wikipedia/commons/a/a3/Green_sea_turtle_%28Chelonia_mydas%29_Moorea.jpg,Wikimedia Commons,"The green sea turtle, also known as the green turtle, black (sea) turtle or Pacific green turtle, is a species of large sea turtle of the family Cheloniidae. It is the only species in the genus Chelonia. Its range extends throughout tropical and subtropical seas around the world, with two distinct populations in the Atlantic and Pacific Oceans, but it is also found in the Indian Ocean. The common name refers to the usually green fat found beneath its carapace, due to its diet strictly being seagrass, not to the color of its carapace, which is olive to black."
Coral Triangle,Hawksbill sea turtle,Hawksbill sea turtle,REPTILIA,CR,Coral reef habitats,https://upload.wikimedia.org/wikipedia/commons/b/b0/Eretmochelys-imbricata-K%C3%A9lonia-2.JPG,Wikimedia Commons,The hawksbill sea turtle is a critically endangered sea turtle belonging to the family Cheloniidae. It is the only extant species in the genus Eretmochelys. The species has a global distribution that is largely limited to tropical and subtropical marine and estuary ecosystems.
Coral Triangle,Leatherback sea turtle,Leatherback sea turtle,REPTILIA,EN,Open ocean,https://upload.wikimedia.org/wikipedia/commons/f/fc/Leatherback_sea_turtle_Tinglar%2C_USVI_%285839996547%29.jpg,Wikimedia Commons,"The leatherback sea turtle, sometimes called the lute turtle, leathery turtle or simply the luth, is the largest of all living turtles and the heaviest non-crocodilian reptile, reaching lengths of up to 2.7 metres and weights of 500 kilograms (1,100 lb). It is the only living species in the genus Dermochelys and family Dermochelyidae. It can easily be differentiated from other modern sea turtles by its lack of a bony shell; instead, its carapace is covered by oily flesh and flexible, leather-like skin, for which it is named. Leatherback turtles have a global range, although there are multiple distinct subpopulations. The species as a whole is considered vulnerable, and some of its subpopulations are critically endangered."
Coral Triangle,Olive ridley sea turtle,Olive ridley sea turtle,REPTILIA,LC,Tropical marine waters,https://upload.wikimedia.org/wikipedia/commons/b/b5/Lepidochelys-olivacea-K%C3%A9lonia-1.JPG,Wikimedia Commons,"The olive ridley sea turtle, also known commonly as the Pacific ridley sea turtle, is a species of turtle in the family Cheloniidae. The species is the second-smallest and most abundant of all sea turtles found in the world. L. olivacea is found in warm and tropical waters, primarily in the Pacific and Indian Oceans, but also in the warm waters of the Atlantic Ocean."
Coral Triangle,Giant oceanic manta ray,Giant oceanic manta ray,CHONDRICHTHYES,NT,Open ocean and reefs,https://upload.wikimedia.org/wikipedia/commons/d/df/Manta_birostris-Thailand4.jpg,Wikimedia Commons,"The giant oceanic manta ray, giant manta ray, or oceanic manta ray is a species of ray in the family Mobulidae and the largest type of ray in the world. It is circumglobal and is typically found in tropical and subtropical waters but can also be found in temperate waters. Until 2017, the species was classified in the genus Manta, along with the smaller reef manta ray. DNA testing revealed that both species are more closely related to rays of the genus Mobula than previously thought. As a result, the giant manta was renamed Mobula birostris to reflect the new classification."
Coral Triangle,Reef manta ray,Reef manta ray,CHONDRICHTHYES,NT,Coastal reef slopes,https://upload.wikimedia.org/wikipedia/commons/3/30/Dharavandhoo_Thila_-_Manata_Black_Pearl.JPG,Wikimedia Commons,"The reef manta ray is a species of ray in the family Mobulidae, one of the largest rays in the world. Among generally recognized species, it is the third-largest species of ray, surpassed by the Giant oceanic manta ray and the Atlantic manta ray."
Coral Triangle,Dugong,Dugong,MAMMALIA,VU,Seagrass meadows,https://upload.wikimedia.org/wikipedia/commons/4/42/Dugong.JPG,Wikimedia Commons,"The dugong is a marine mammal. It is one of four living species of the order Sirenia, which also includes three species of manatees. It is the only living representative of the once-diverse family Dugongidae; its closest modern relative, Steller's sea cow, was hunted to extinction in the 18th century."
Coral Triangle,Spinner dolphin,Spinner dolphin,MAMMALIA,LC,Coastal tropical waters,https://upload.wikimedia.org/wikipedia/commons/6/64/A_spinner_dolphin_in_the_Red_Sea.jpg,Wikimedia Commons,The spinner dolphin is a small dolphin found in off-shore tropical waters around the world. It is famous for its acrobatic displays in which it rotates around its longitudinal axis as it leaps through the air. It is a member of the family Delphinidae of toothed whales.
Coral Triangle,Indo-Pacific bottlenose dolphin,Indo-Pacific bottlenose dolphin,MAMMALIA,LC,Coastal waters,https://upload.wikimedia.org/wikipedia/commons/8/87/Tursiops_aduncus%2C_Port_River%2C_Adelaide%2C_Australia_-_2003.jpg,Wikimedia Commons,"The Indo-Pacific bottlenose dolphin is a species of bottlenose dolphin. This dolphin grows to 2.6 m (8.5 ft) long, and weighs up to 230 kg (510 lb). It lives in the waters around India, northern Australia, South China, the Red Sea, and the eastern coast of Africa. Its back is dark grey and its belly is lighter grey or nearly white with grey spots."
Coral Triangle,Irrawaddy dolphin,Irrawaddy dolphin,MAMMALIA,VU,Coastal and estuarine waters,https://upload.wikimedia.org/wikipedia/commons/a/ae/Irrawaddy_dolphin-Orcaella_brevirostris_by_2eight.jpg,Wikimedia Commons,"The Irrawaddy dolphin is a euryhaline species of oceanic dolphin found in scattered subpopulations near sea coasts and in estuaries and rivers in parts of the Bay of Bengal and Southeast Asia. It closely resembles the Australian snubfin dolphin, which was not described as a separate species until 2005. It has a slate blue to a slate gray color. Although found in much of the riverine and marine zones of South and Southeast Asia, the only concentrated lagoon populations are found in Chilika Lake in Odisha, India and Songkhla Lake in southern Thailand."
Coral Triangle,Bryde's whale,Bryde's whale,MAMMALIA,LC,Tropical pelagic waters,https://upload.wikimedia.org/wikipedia/commons/3/35/Balaenoptera_brydei.jpg,Wikimedia Commons,"Bryde's whale, or the Bryde's whale complex, putatively comprises three species of rorqual and possibly four. The ""complex"" means the number and classification remain unclear because of a lack of definitive information and research. The common Bryde's whale is a larger form that occurs worldwide in warm temperate and tropical waters, and the Sittang or Eden's whale is a smaller form that may be restricted to the Indo-Pacific. Also, a smaller, coastal form of B. brydei is found off southern Africa, and perhaps another form in the Indo-Pacific differs in skull morphology, tentatively referred to as the Indo-Pacific Bryde's whale. The recently described Omura's whale, was formerly thought to be a pygmy form of Bryde's, but is now recognized as a distinct species. Rice's whale, which makes its home solely in the Gulf of Mexico, was once considered a distinct population of Bryde's whale, but in 2021 it was described as a separate species."
Coral Triangle,Sperm whale,Sperm whale,MAMMALIA,VU,Deep ocean,https://upload.wikimedia.org/wikipedia/commons/b/b1/Mother_and_baby_sperm_whale.jpg,Wikimedia Commons,"The sperm whale or cachalot is the largest of the toothed whales and the largest toothed predator. It is the only living member of the genus Physeter and one of three extant species in the sperm whale superfamily Physeteroidea, along with the pygmy sperm whale and dwarf sperm whale of the genus Kogia."
Coral Triangle,Humphead wrasse,Humphead wrasse,ACTINOPTERYGII,VU,Coral reefs,https://upload.wikimedia.org/wikipedia/commons/4/49/Humphead_wrasse_melb_aquarium.jpg,Wikimedia Commons,"The humphead wrasse is a large species of wrasse mainly found on coral reefs in the Indo-Pacific region. It is also known as the Māori wrasse, napoleon wrasse, and napoleonfish. It is in the Pohnpeian language of the Caroline Islands."
Coral Triangle,Bumphead parrotfish,Bumphead parrotfish,ACTINOPTERYGII,VU,Coral reefs,https://upload.wikimedia.org/wikipedia/commons/a/a0/Bumphead_parrotfish_%28Bolbometopon_muricatum%29_%2849509140173%29.jpg,Wikimedia Commons,"The green humphead parrotfish is the largest species of parrotfish, growing to lengths of 1.5 m (4.9 ft) and weighing up to 75 kg (165 lb)."
Coral Triangle,Giant clam,Giant clam,BIVALVIA,VU,Coral reef flats,https://upload.wikimedia.org/wikipedia/commons/6/6f/Giant_clam_%28Tridacna_gigas%29_Michaelmas_Cay.jpg,Wikimedia Commons,"Tridacna gigas, the giant clam, is the best-known species of the giant clam genus Tridacna. Giant clams are the largest living bivalve molluscs. Several other species of ""giant clam"" in the genus Tridacna are often misidentified as Tridacna gigas."
Coral Triangle,Crown-of-thorns starfish,Crown-of-thorns starfish,ANTHOZOA,NT,Coral reefs,https://upload.wikimedia.org/wikipedia/commons/8/8f/CrownofThornsStarfish_Fiji_2005-10-12.jpg,Wikimedia Commons,"The crown-of-thorns starfish, Acanthaster planci, is a large starfish that preys upon hard, or stony, coral polyps (Scleractinia). The crown-of-thorns starfish receives its name from venomous thornlike spines that cover its upper surface, resembling the biblical crown of thorns. It is one of the largest starfish in the world."
Coral Triangle,Blue-ringed octopus,Blue-ringed octopus,MALACOSTRACA,VU,Shallow reefs,https://upload.wikimedia.org/wikipedia/commons/f/f2/Hapalochlaena_lunulata2.JPG,Wikimedia Commons,"Blue-ringed octopuses, comprising the genus Hapalochlaena, are four extremely venomous species of octopus that are found in tide pools and coral reefs in the Pacific and Indian Oceans, from Japan to Australia. They can be identified by their yellowish skin and characteristic blue and black rings that can change color dramatically when the animals are threatened. They eat small crustaceans, including crabs, hermit crabs, shrimp, and other small sea animals."
Coral Triangle,Mandarin fish,Mandarin dragonet,ACTINOPTERYGII,LC,Lagoon reefs,https://upload.wikimedia.org/wikipedia/commons/2/2d/Synchiropus_splendidus_2_Luc_Viatour.jpg,Wikimedia Commons,"Synchiropus splendidus, the mandarinfish or mandarin dragonet, is a small, brightly colored member of the dragonet family, which is popular in the saltwater aquarium trade. The mandarinfish is native to the Pacific, ranging approximately from the Ryukyu Islands south to Australia. It can usually be found in some of the warmer waters."
Coral Triangle,Moorish idol,Moorish idol,ACTINOPTERYGII,LC,Coral reefs,https://upload.wikimedia.org/wikipedia/commons/7/71/%C3%8Ddolo_moro_%28Zanclus_cornutus%29%2C_Anilao%2C_Filipinas%2C_2023-08-25%2C_DD_233.jpg,Wikimedia Commons,The Moorish idol is a species of marine ray-finned fish belonging to the family Zanclidae. It is the only member of the monospecific genus Zanclus and the only extant species within the Zanclidae. This species is found on reefs in the Indo-Pacific region.
Coral Triangle,Banggai cardinalfish,Banggai cardinalfish,ACTINOPTERYGII,EN,Seagrass beds and reefs,https://upload.wikimedia.org/wikipedia/commons/b/bd/Banggai_cardinalfish_%28Pterapogon_kauderni%29_%2843875107345%29.jpg,Wikimedia Commons,"The Banggai cardinalfish is a small tropical cardinalfish in the family Apogonidae. It is the only member of its genus. This attractive fish is popular in the aquarium trade. It is among the relatively few marine fish to have been bred regularly in captivity, but significant numbers are still captured in the wild and it is now an endangered species. The detrimental impact of humans on its environment and certain fatal diseases threaten this species' numbers significantly. Iridovirus diseases are known to be significant reason for fish mortality."
Coral Triangle,Clown triggerfish,Clown triggerfish,ACTINOPTERYGII,LC,Outer reef slopes,https://upload.wikimedia.org/wikipedia/commons/a/a4/Balistoides_conspicillum_2607.jpg,Wikimedia Commons,"The clown triggerfish, also known as the bigspotted triggerfish, is a demersal marine fish."
Coral Triangle,Blacktip reef shark,Blacktip reef shark,CHONDRICHTHYES,NT,Shallow coral reefs,https://upload.wikimedia.org/wikipedia/commons/7/76/Blacktip_reef_shark_%28Carcharhinus_melanopterus%29_Moorea_5.jpg,Wikimedia Commons,"The blacktip reef shark is a species of requiem shark, in the family Carcharhinidae, which can be easily identified by the prominent black tips on its fins. Among the most abundant sharks inhabiting the tropical coral reefs of the Indian and Pacific Oceans, this species prefers shallow, inshore waters. Its exposed first dorsal fin is a common sight in the region. The blacktip reef shark is usually found over reef ledges and sandy flats, though it has also been known to enter brackish and freshwater environments. It typically attains a length of 1.6 m (5.2 ft). Like other sharks, the females are larger than the males."
Coral Triangle,Grey reef shark,Grey reef shark,CHONDRICHTHYES,NT,Outer reef slopes,https://upload.wikimedia.org/wikipedia/commons/0/08/Corl0207_%2828225976491%29.jpg,Wikimedia Commons,"The grey reef shark or gray reef shark is a species of requiem shark, in the family Carcharhinidae. One of the most common reef sharks in the Indo-Pacific, it is found as far east as Easter Island and as far west as South Africa. This species is most often seen in shallow water near the drop-offs of coral reefs. It has the typical ""reef shark"" shape, with a broad, round snout and large eyes. It can be distinguished from similar species by the plain or white-tipped first dorsal fin, the dark tips on the other fins, the broad, black rear margin on the tail fin, and the lack of a ridge between the dorsal fins. Most individuals are less than 1.88 m (6.2 ft) long."
Coral Triangle,Whitetip reef shark,Whitetip reef shark,CHONDRICHTHYES,NT,Coral reefs,https://upload.wikimedia.org/wikipedia/commons/9/95/Carcharhinus_albimarginatus-shark.jpg,Wikimedia Commons,"The whitetip reef shark is a species of requiem shark, in the family Carcharhinidae, and the only member of its genus. A small shark that does not usually exceed 1.6 m (5.2 ft) in length, this species is easily recognizable by its slender body and short but broad head, as well as tubular skin flaps beside the nostrils, oval eyes with vertical pupils, and white-tipped dorsal and caudal fins. One of the most common sharks found on Indo-Pacific coral reefs, the whitetip reef shark occurs as far west as South Africa and as far east as Central America. It is typically found on or near the bottom in clear water, at a depth of 8–40 m (26–131 ft)."
Coral Triangle,Silvertip shark,Silvertip shark,CHONDRICHTHYES,VU,Outer reef slopes,https://upload.wikimedia.org/wikipedia/commons/5/5c/Silvertip_shark_%28Carcharhinis_albimarginatus%29.jpg,Wikimedia Commons,"The silvertip shark is a large species of requiem shark, in the family Carcharhinidae, with a fragmented distribution throughout the tropical Indian and Pacific Oceans. It is often encountered around offshore islands and coral reefs, and has been known to dive to a depth of 800 m (2,600 ft). The silvertip shark resembles a larger and bulkier grey reef shark, but can be easily identified by the prominent white margins on its fins. It attains a maximum length of 3 m (10 ft)."
Coral Triangle,Tawny nurse shark,Tawny nurse shark,CHONDRICHTHYES,NT,Coral and seagrass habitats,https://upload.wikimedia.org/wikipedia/commons/f/f1/Ginglymostoma_cirratum_Maldives.JPG,Wikimedia Commons,"The tawny nurse shark is a species of carpet shark in the family Ginglymostomatidae, and the only extant member of the genus Nebrius."
Coral Triangle,Chambered nautilus,Chambered nautilus,GASTROPODA,NT,Deep reef slopes,https://upload.wikimedia.org/wikipedia/commons/4/4a/Nautilus_pompilius_%28detail%29.jpg,Wikimedia Commons,"The chambered nautilus, also called the pearly nautilus, is the best-known species of nautilus. The shell, when cut away, reveals a lining of lustrous nacre and displays a nearly perfect equiangular spiral, although it is not a golden spiral. The shell exhibits countershading, being light on the bottom and dark on top. This is to help avoid predators, because when seen from above, it blends in with the darkness of the sea, and when seen from below, it blends in with the light coming from above."
Coral Triangle,Peacock mantis shrimp,Peacock mantis shrimp,MALACOSTRACA,LC,Coral rubble,https://upload.wikimedia.org/wikipedia/commons/1/1e/Odontodactylus_scyllarus_R%C3%A9union.jpg,Wikimedia Commons,"Odontodactylus scyllarus, commonly known as the peacock mantis shrimp, harlequin mantis shrimp, painted mantis shrimp, clown mantis shrimp, rainbow mantis shrimp, or simply mantis shrimp, is a large Stomatopod native to the epipelagic seabed across the Indo-Pacific, ranging from the Marianas to East Africa, and as far South as Northern KwaZulu Natal in South Africa. It is one of roughly 480 species of mantis shrimp, which are well known for their raptorial claws, exceptional vision, and their unique way of interacting with other marine species."
Coral Triangle,Harlequin shrimp,Harlequin shrimp,MALACOSTRACA,LC,Coral reefs,https://upload.wikimedia.org/wikipedia/commons/9/9c/Hymenocera_picta_en_train_de_retourner_Fromia_milleporella.JPG,Wikimedia Commons,"Hymenocera picta, commonly known as the harlequin shrimp, is a species of saltwater shrimp found at coral reefs in the tropical Indian and Pacific Oceans. It is usually considered the only species in the genus Hymenocera, but some split it into two species: H. picta from the central and east Pacific, where the spots are deep pinkish-purple with a yellow edge, and H. elegans from the Indian Ocean and west Pacific, where the spots are more brownish and have a blue edge. They reach about 5 cm (2.0 in) in length, live in pairs, and feed exclusively on starfish, including crown-of-thorns starfish. They do seem to prefer smaller, more sedentary starfish, but as these generally are not sufficiently numerous for their needs, they commonly attack crown-of-thorns starfish, both reducing its consumption of coral while under attack, and killing it within a few days."
Coral Triangle,Pygmy seahorse,Pygmy seahorse,ACTINOPTERYGII,DD,Gorgonian corals,https://upload.wikimedia.org/wikipedia/commons/d/df/Hippocampus_bargibanti2.JPG,Wikimedia Commons,"The pygmy seahorses comprise several species of tiny seahorse in the family Syngnathidae (seahorses and pipefishes) and in the order Syngnathiformes, which contains fishes with fused jaws that suck food into tubular mouths."
Coral Triangle,Banded sea krait,Banded sea krait,REPTILIA,LC,Coral reefs,https://upload.wikimedia.org/wikipedia/commons/a/ad/Banded_Sea_Krait_%28Laticauda_colubrina%29_%2814641328165%29.jpg,Wikimedia Commons,"The yellow-lipped sea krait, also known as the banded sea krait or colubrine sea krait, is a species of highly venomous snake found in tropical Indo-Pacific oceanic waters. The snake has distinctive black stripes and a yellow snout, with a paddle-like tail for use in swimming."
Coral Triangle,Giant trevally,Giant trevally,ACTINOPTERYGII,LC,Reef passes and lagoons,https://upload.wikimedia.org/wikipedia/commons/e/ed/Caranx_ignobilis.jpg,Wikimedia Commons,"The giant trevally, also known as the lowly trevally, barrier trevally, ronin jack, giant kingfish, or ulua, is a species of large marine fish classified in the jack family, Carangidae. The giant trevally is distributed throughout the tropical waters of the Indo-Pacific region, with a range stretching from South Africa to Hawaii, including Japan in the north and Australia in the south. Two were documented in the eastern tropical Pacific in the 2010s, but whether the species will become established there remains to be seen."
Coral Triangle,Indo-Pacific sailfish,Indo-Pacific sailfish,ACTINOPTERYGII,LC,Open ocean,https://upload.wikimedia.org/wikipedia/commons/d/dc/Istiophorus_platypterus_101956558.jpg,Wikimedia Commons,"The Indo-Pacific sailfish is a sailfish native to the Indian and Pacific Oceans and is naturalized in the Atlantic where it has entered the Mediterranean Sea via the Suez Canal as a Lessepsian migrant. It is dark blue on top, brown-blue laterally, silvery white underbelly; upper jaw elongated in the form of a spear; first dorsal fin greatly enlarged in the form of a sail, with many black cones, its front squared off, highest at its midpoint; pelvic fins very narrow, reaching almost to the anus; body covered with embedded scales, blunt at end; lateral line curved above pectoral fin, then straight to base of tail. They have a large and sharp bill, which they use for hunting. They feed on tuna and mackerel, some of the fastest fish in the ocean. Most authorities only recognise a single species of sailfish, I. platypterus."
Coral Triangle,Bigfin reef squid,Bigfin reef squid,MALACOSTRACA,LC,Coastal waters,https://upload.wikimedia.org/wikipedia/commons/f/f2/Bigfin_reef_squid_%2811760%29.jpg,Wikimedia Commons,"Sepioteuthis lessoniana, commonly known as the bigfin reef squid, tiger squid, glitter squid, oval squid, or northern calamari, is a species complex in the loliginid squid family. It is one of the three currently recognized species belonging to the genus Sepioteuthis. Studies in 1993, however, have indicated that bigfin reef squids may comprise several cryptic species, that are very similar and closely related."
Coral Triangle,Bubble-tip anemone,Bubble-tip anemone,ANTHOZOA,LC,Coral reefs,https://upload.wikimedia.org/wikipedia/commons/4/4d/Entacmaea_quadricolor_%28Bubble_tip_anemone%29.jpg,Wikimedia Commons,"Bubble-tip anemone is a species of sea anemone in the family Actiniidae. Like several anemone species, E. quadricolor can support several anemonefish species, and displays two growth types based on where they live in the water column, one of which gives it the common name, due to the bulbous tips on its tentacles."
Coral Triangle,Acropora millepora,Staghorn coral,ANTHOZOA,NT,Reef-building coral,https://upload.wikimedia.org/wikipedia/commons/9/91/Acropora_millepora_Maldives.jpg,Wikimedia Commons,Acropora millepora is a species of branching stony coral native to the western Indo-Pacific where it is found in shallow water from the east coast of Africa to the coasts of Japan and Australia. It was first described in 1834 by Christian Gottfried Ehrenberg as Heteropora millepora.
Coral Triangle,Porites lutea,Unknown,ANTHOZOA,LC,Massive reef coral,https://upload.wikimedia.org/wikipedia/commons/9/96/Porites_lutea.jpg,Wikimedia Commons,"Porites lutea is a species of stony coral in the family Poritidae. It is found growing in very shallow water on reefs in the Indo-Pacific region. It sometimes forms ""microatolls"" in the intertidal zone and these massive structures have been used to study trends in sea levels and sea water temperature."
Coral Triangle,Thalassia hemprichii,Pacific turtlegrass,MAGNOLIOPSIDA,LC,Seagrass meadows,https://upload.wikimedia.org/wikipedia/commons/f/f7/Thalassia_hemprichii.jpg,Wikimedia Commons,"Thalassia hemprichii, called Pacific turtlegrass, is a widespread species of seagrass in the genus Thalassia, native to the shores of the Indian Ocean, the Red Sea, and the western Pacific Ocean. Its growth rate increases with CO2 enrichment, and it can tolerate lowered light conditions caused by algal blooms, allowing for it to respond positively to ocean acidification and other disturbances."
Coral Triangle,Halophila ovalis,Paddle weed,MAGNOLIOPSIDA,LC,Seagrass meadows,https://upload.wikimedia.org/wikipedia/commons/e/ed/Halophila_ovalis.jpg,Wikimedia Commons,"Halophila ovalis, commonly known as paddle weed, spoon grass or dugong grass, is a seagrass in the family Hydrocharitaceae. It is a small herbaceous plant that naturally occurs in sea beds and other saltwater environments in the Indo-Pacific. It was introduced as isolated populations in Florida, Cuba and Antigua."
