ecoregion,scientific_name,common_name,class,conservation_status,habitat_type,image_url,attribution,description
Amazon and Guianas,Brazil nut,Brazil nut tree,MAGNOLIOPSIDA,NT,Terra firme forest,https://upload.wikimedia.org/wikipedia/commons/3/39/Bertholletia_excelsa_compose.jpg,Wikimedia Commons,"Brazil nut refers to a South American tree in the family Lecythidaceae as well as the tree's commercially-harvested edible seeds. It is one of the largest and longest-lived trees in the Amazon rainforest. The fruit and its nutshell – containing the edible nut – are relatively large and weigh as much as 2 kg (4.4 lb) in total. As food, Brazil nuts are notable for diverse content of micronutrients, especially a high amount of selenium. The wood of the Brazil nut tree is prized for its quality in carpentry, flooring, and heavy construction."
Amazon and Guianas,Hevea brasiliensis,Rubber tree,MAGNOLIOPSIDA,LC,Tropical rainforest,https://upload.wikimedia.org/wikipedia/commons/1/1d/Hevea_brasiliensis_-_K%C3%B6hler%E2%80%93s_Medizinal-Pflanzen-071.jpg,Wikimedia Commons,"Hevea brasiliensis, the Pará rubber tree, sharinga tree, seringueira, or most commonly, rubber tree or rubber plant, is a flowering plant belonging to the spurge family, Euphorbiaceae, originally native to the Amazon basin, but is now pantropical in distribution due to introductions. It is the most economically important member of the genus Hevea because the milky latex extracted from the tree is the primary source of natural rubber."
Amazon and Guianas,Theobroma cacao,Cacao tree,MAGNOLIOPSIDA,LC,Understory rainforest,https://upload.wikimedia.org/wikipedia/commons/5/5a/Matadecacao.jpg,Wikimedia Commons,"Theobroma cacao is a small evergreen tree in the Malvaceae family. Its seeds—cocoa beans—are used to make chocolate liquor, cocoa solids, cocoa butter and chocolate. Although the tree is native to the tropics of the Americas, the largest producer of cocoa beans in 2022 was Ivory Coast. The plant's leaves are alternate, entire, unlobed, 10–50 cm (4–20 in) long and 5–10 cm (2–4 in) broad."
Amazon and Guianas,Euterpe oleracea,Açaí palm,MAGNOLIOPSIDA,LC,Floodplain forests,https://upload.wikimedia.org/wikipedia/commons/e/e4/Euterpe_oleracea_salu.jpg,Wikimedia Commons,"The açaí palm, Euterpe oleracea, is a species of palm tree (Arecaceae) cultivated for its fruit, hearts of palm, leaves, and trunk wood. Global demand for the fruit has expanded rapidly in the 21st century, and the tree is cultivated for that purpose primarily."
Congo Basin,Western lowland gorilla,Western lowland gorilla,MAMMALIA,CR,Swamp forest,https://upload.wikimedia.org/wikipedia/commons/0/07/WesternLowlandGorilla03.jpg,Wikimedia Commons,"The western lowland gorilla is one of two Critically Endangered subspecies of the western gorilla that lives in montane, primary and secondary forest and lowland swampland in central Africa in Angola, Cameroon, Central African Republic, Republic of the Congo, Democratic Republic of the Congo, Equatorial Guinea and Gabon. It is the nominate subspecies of the western gorilla, and the smallest of the four gorilla subspecies."
Congo Basin,Bonobo,Bonobo,MAMMALIA,EN,Lowland rainforest,https://upload.wikimedia.org/wikipedia/commons/e/e2/Apeldoorn_Apenheul_zoo_Bonobo.jpg,Wikimedia Commons,"The bonobo, also historically called the pygmy chimpanzee, is an endangered great ape and one of the two species making up the genus Pan. While bonobos are today recognized as a distinct species, they were initially thought to be a subspecies of Pan troglodytes, because of the physical similarities between the two species. Taxonomically, members of the chimpanzee/bonobo subtribe Panina—composed entirely by the genus Pan—are collectively termed panins."
Congo Basin,Okapi,Okapi,MAMMALIA,VU,Ituri rainforest,https://upload.wikimedia.org/wikipedia/commons/3/3a/Saint-Aignan_%28Loir-et-Cher%29._Okapi.jpg,Wikimedia Commons,"The okapi, also known as the forest giraffe, Congolese giraffe and zebra giraffe, is an artiodactyl mammal that is endemic to the northeast Democratic Republic of the Congo in central Africa. However, non-invasive genetic identification has suggested that a population has occurred south-west of the Congo River as well. It is the only species in the genus Okapia. Although the okapi has striped markings reminiscent of zebras, it is most closely related to the giraffe. The okapi and the giraffe are the only living members of the family Giraffidae."
Congo Basin,Forest buffalo,Forest buffalo,MAMMALIA,VU,Swamp forest,https://upload.wikimedia.org/wikipedia/commons/4/49/African_Forest_Buffalo.jpg,Wikimedia Commons,"The African forest buffalo, also known as the dwarf buffalo, red buffalo, Congo buffalo or bush-cow, is the smallest subspecies of the African buffalo. It is related to the Cape buffalo, the Sudan buffalo, and the Nile buffalo. However, it is the only subspecies that occurs mainly in the rainforests of Central Africa and Western Africa, with an annual rainfall around 1,500 mm (59 in). It has been proposed to represent a distinct species, Syncerus nanus."
Congo Basin,Sitatunga,Sitatunga,MAMMALIA,LC,Swamp forest,https://upload.wikimedia.org/wikipedia/commons/c/cc/Sitatunga_at_Oji_Zoo.JPG,Wikimedia Commons,"The sitatunga or marshbuck is a swamp-dwelling medium-sized antelope found throughout central Africa, centering on the Democratic Republic of the Congo, the Republic of the Congo, Cameroon, parts of Southern Sudan, Equatorial Guinea, Burundi, Ghana, Botswana, Rwanda, Zambia, Gabon, the Central African Republic, Tanzania, Uganda and Kenya.
The sitatunga is mostly confined to swampy and marshy habitats. They occur in tall and dense vegetation as well as seasonal swamps, marshy clearings in forests, riparian thickets and mangrove swamps."
Congo Basin,African grey parrot,African grey parrot,AVES,NT,Rainforest canopy,https://upload.wikimedia.org/wikipedia/commons/3/3c/Perroquet_%C3%A0_Yampopo_Beach_-_Douala.jpg,Wikimedia Commons,"The grey parrot, also known as the Congo grey parrot, is an African parrot in the family Psittacidae. It was previously also known as the African grey parrot until the Timneh parrot, previously treated as a subspecies, was elevated to a full species."
Congo Basin,Congo peafowl,Congo peafowl,AVES,NT,Montane forest,https://upload.wikimedia.org/wikipedia/commons/3/32/Afropavo_congensis_-Antwerp_Zoo_-pair-8a.jpg,Wikimedia Commons,"The Congo peafowl, also known as the African peafowl or mbulu by the Bakôngo, is a species of peafowl native to the Congo Basin. It is one of three peafowl species and the only member of the subfamily Pavoninae native to Africa. It is listed as Near Threatened on the IUCN Red List."
Congo Basin,Shoebill,Shoebill,AVES,NT,Swamp wetlands,https://upload.wikimedia.org/wikipedia/commons/c/c0/Balaeniceps_rex.jpg,Wikimedia Commons,"The shoebill, also known as the whale-headed stork, and shoe-billed stork, is a large long-legged wading bird. Its name comes from its enormous shoe-shaped bill. It has a somewhat stork-like overall form and was previously classified as a stork in the order Ciconiiformes; but genetic evidence places it with pelicans and herons in the Pelecaniformes. The adult is mainly grey while the juveniles are more brown. It lives in tropical East Africa in large swamps from South Sudan to Zambia."
Congo Basin,Slender-snouted crocodile,Slender-snouted crocodile,REPTILIA,VU,Freshwater rivers,https://upload.wikimedia.org/wikipedia/commons/a/a3/Crocodylus_cataphractus_faux-gavial_d%27Afrique2.JPG,Wikimedia Commons,"Mecistops is a genus of crocodiles, the slender-snouted crocodiles, native to sub-Saharan Africa."
Congo Basin,Nile crocodile,Nile crocodile,REPTILIA,LC,Rivers and wetlands,https://upload.wikimedia.org/wikipedia/commons/8/81/NileCrocodile.jpg,Wikimedia Commons,"The Nile crocodile is a large crocodilian native to freshwater habitats in Africa, where it is present in 26 countries. It is widely distributed in sub-Saharan Africa, occurring mostly in the eastern, southern, and central regions of the continent, and lives in different types of aquatic environments such as lakes, rivers, swamps and marshlands. It occasionally inhabits deltas, brackish lakes and rarely also saltwater. Its range once stretched from the Nile Delta throughout the Nile River. Lake Turkana in Kenya has one of the largest undisturbed Nile crocodile populations."
Congo Basin,Goliath tigerfish,Goliath tigerfish,ACTINOPTERYGII,NT,Congo River,https://upload.wikimedia.org/wikipedia/commons/c/ce/Hydrocynus_goliath_-_Poisson-chien_-_Aqua_porte_Dor%C3%A9e_06.JPG,Wikimedia Commons,"Hydrocynus goliath, also known as the goliath tigerfish, giant tigerfish, or mbenga, is a very large African predatory freshwater fish of the family Alestidae."
Congo Basin,African lungfish,African lungfish,ACTINOPTERYGII,LC,Floodplains,https://upload.wikimedia.org/wikipedia/commons/b/b8/G%C5%91tehal-2.jpg,Wikimedia Commons,"Protopterus is the genus of four species of lungfish found in Africa. Protopterus is considered the sole genus in the family Protopteridae, which is grouped with Lepidosiren in the order Lepidosireniformes."
Congo Basin,Electric catfish,Electric catfish,ACTINOPTERYGII,DD,Slow rivers,https://upload.wikimedia.org/wikipedia/commons/b/b5/Malapterurus_electricus_1.jpg,Wikimedia Commons,"Electric catfish, or Malapteruridae, is a family of catfishes. This family includes two genera, Malapterurus and Paradoxoglanis, with 21 species. Several species of this family have the ability to generate electricity, delivering a shock of up to 350 volts from its electric organ. Electric catfish are found in tropical Africa and the Nile River. Electric catfish are usually nocturnal and carnivorous. Some species feed primarily on other fish, incapacitating their prey with electric discharges, but others are generalist bottom foragers, feeding on things like invertebrates, fish eggs, and detritus. The largest can grow to about 1.2 meters long, but most species are far smaller."
Congo Basin,Goliath frog,Goliath frog,AMPHIBIA,VU,Rainforest streams,https://upload.wikimedia.org/wikipedia/commons/d/d7/Goliath_Frog.jpg,Wikimedia Commons,"The goliath frog, otherwise known commonly as the giant slippery frog and the goliath bullfrog, is a species of frog in the family Conrauidae. The goliath frog is the largest living frog. Specimens can reach up to about 45 centimetres (18 in) in snout–vent length and 4.5 kilograms (9.9 lb) in weight. This species has a relatively small habitat range in Cameroon and Equatorial Guinea. Its numbers are dwindling due to habitat destruction, collection for food, and the pet trade."
Congo Basin,Gaboon viper,Gaboon viper,REPTILIA,LC,Rainforest floor,https://upload.wikimedia.org/wikipedia/commons/9/98/Bitis_gabonica.jpg,Wikimedia Commons,"The Gaboon viper, also called the Gaboon adder, is a large and highly venomous viper species found in the rainforests and savannas of sub-Saharan Africa. It is the largest member of the genus Bitis. Like all other vipers, it is venomous, and it has the longest fangs of any venomous snake – up to 2 inches (5.1 cm) in length – and the highest venom yield of any snake. No subspecies are recognized."
Congo Basin,Forest cobra,Forest cobra,REPTILIA,VU,Rainforest floor,https://upload.wikimedia.org/wikipedia/commons/1/13/Cobra_des_for%C3%AAts.jpg,Wikimedia Commons,"The forest cobra, also commonly called the black cobra and the black and white-lipped cobra, is a species of 
highly venomous snake in the family Elapidae. The species is native to Africa, mostly the central and western parts of the continent. It is the largest true cobra species with a record length of 3.2 metres."
Congo Basin,Giant pangolin,Giant pangolin,MAMMALIA,VU,Rainforest floor,https://upload.wikimedia.org/wikipedia/commons/0/0c/Giant_pangolin_%28Manis_gigantea%29%2C_Natural_History_Museum%2C_London%2C_Mammals_Gallery.JPG,Wikimedia Commons,The giant pangolin is a species of pangolin from genus Smutsia of subfamily Smutsiinae within the family Manidae. It is the largest living species of pangolins. Members of the species inhabit Africa with a range stretching along the equator from West Africa to Uganda. It subsists almost entirely on ants and termites.
Congo Basin,Tree pangolin,Tree pangolin,MAMMALIA,VU,Rainforest canopy,https://upload.wikimedia.org/wikipedia/commons/2/22/Tree_pangolin_%28Phataginus_tricuspis%29_Nyamebe_Bepo.jpg,Wikimedia Commons,"The white-bellied pangolin is one of eight extant species of pangolins, and is native to equatorial Africa. Also known as the tree pangolin or three-cusped pangolin, it is the most common of the African forest pangolins."
Congo Basin,Mandrill,Mandrill,MAMMALIA,VU,Rainforest,https://upload.wikimedia.org/wikipedia/commons/e/ed/Mandrill_Albert_September_2015_Zoo_Berlin_%282%29.jpg,Wikimedia Commons,"The mandrill is a large Old World monkey native to west central Africa. It is one of the most colorful mammals in the world, with red and blue skin on its face and posterior. The species is sexually dimorphic, as males have a larger body, longer canine teeth and brighter coloring. Its closest living relative is the drill, with which it shares the genus Mandrillus. Both species were traditionally thought to be baboons, but further evidence has shown that they are more closely related to white-eyelid mangabeys."
Congo Basin,De Brazza's monkey,De Brazza's monkey,MAMMALIA,NT,Riparian forests,https://upload.wikimedia.org/wikipedia/commons/1/12/1_de_brazza%27s_monkey_2024.jpg,Wikimedia Commons,"De Brazza's monkey is an Old World monkey endemic to the riverine and swamp forests of central Africa. The largest species in the guenon family, it is one of the most widespread arboreal African primates. Aside from size, it can be differentiated from other Cercopithecus monkeys by its orange diadem and white beard. Due to its cryptic nature, the species is not well documented in all of its habitats but has shown unique traits, such as pair-bonding and aggressive behavior towards other guenons."
Congo Basin,Pennant's colobus,Pennant's colobus,MAMMALIA,VU,Lowland rainforest,https://upload.wikimedia.org/wikipedia/commons/a/a7/Piliocolobus_pennantii.jpg,Wikimedia Commons,"Pennant's colobus or Pennant's red colobus is a species of tree-dwelling primate in the family Cercopithecidae. It is endemic to tropical Central Africa. Three subspecies have traditionally been recognised but their distribution is peculiarly disjunct and has been considered a biogeographical puzzle, with one population on the island of Bioko, a second in the Niger River Delta in southern Nigeria, and a third in the east-central Republic of Congo. It is found in rainforests and marshy forests. It is threatened by habitat loss and hunting for bushmeat."
Congo Basin,Blue monkey,Blue monkey,MAMMALIA,LC,Mid-altitude forests,https://upload.wikimedia.org/wikipedia/commons/5/53/Blue_monkey_%28Cercopithecus_mitis_stuhlmanni%29.jpg,Wikimedia Commons,"The blue monkey or diademed monkey is a species of Old World monkey native to Central and East Africa, ranging from the upper Congo River basin east to the East African Rift and south to northern Angola and Zambia. It sometimes includes Sykes', silver, and golden monkeys as subspecies."
Congo Basin,Allen's swamp monkey,Allen's swamp monkey,MAMMALIA,VU,Swamp forest,https://upload.wikimedia.org/wikipedia/commons/2/2a/Allens_swamp_monkey.jpg,Wikimedia Commons,"The Allen's swamp monkey is a species of Old World monkey and the only member of the genus Allenopithecus. Phylogenetically, it is a sister clade to the guenons, but differs in dentition and habits."
Congo Basin,Potto,Potto,MAMMALIA,VU,Rainforest canopy,https://upload.wikimedia.org/wikipedia/commons/9/93/PottoCincyZoo.jpg,Wikimedia Commons,"The pottos are three species of strepsirrhine primate in the genus Perodicticus of the family Lorisidae. In some English-speaking parts of Africa, they are called ""softly-softlys""."
Congo Basin,Hammer-headed bat,Hammer-headed bat,MAMMALIA,VU,Riverine forest,https://upload.wikimedia.org/wikipedia/commons/5/53/Hypsignathus_monstrosus.png,Wikimedia Commons,"The hammer-headed bat, also known as hammer-headed fruit bat, big-lipped bat, and hammerhead bat, is a megabat widely distributed in West and Central Africa. It is the only member of the genus Hypsignathus, which is part of the tribe Epomophorini along with four other genera. It is the largest bat in continental Africa, with wingspans approaching 1 m (3.3 ft), and males are almost twice as heavy as females. Males and females also greatly differ in appearance, making it the most sexually dimorphic bat species in the world. These differences include several adaptations that help males produce and amplify vocalizations: the males' larynges are about three times as large as those of females, and they have large resonating chambers on their faces. Females appear more like a typical megabat, with foxlike faces."
Congo Basin,Lord Derby's anomalure,Lord Derby's anomalure,MAMMALIA,LC,Primary forest,,,
Congo Basin,African golden cat,African golden cat,MAMMALIA,VU,Montane forest,https://upload.wikimedia.org/wikipedia/commons/c/c4/Caracal_aurata_2.jpg,Wikimedia Commons,"The African golden cat is a wild cat endemic to the rainforests of West and Central Africa. It is threatened due to deforestation and bushmeat hunting and listed as Vulnerable on the IUCN Red List. It is a close relative of both the caracal and the serval. Previously, it was placed in the genus Profelis. Its body size ranges from 61 to 101 cm with a 16 to 46 cm long tail."
Congo Basin,African leopard,African leopard,MAMMALIA,NT,Forest mosaic,https://upload.wikimedia.org/wikipedia/commons/7/70/African_leopard_male_%28cropped%29.jpg,Wikimedia Commons,"The African leopard is the nominate subspecies of the leopard, native to Africa. It is widely distributed in most of sub-Saharan Africa, but the historical range has been fragmented in the course of habitat conversion. Leopards have also been recorded in North Africa as well."
Congo Basin,African palm civet,African palm civet,MAMMALIA,LC,Rainforest canopy,https://upload.wikimedia.org/wikipedia/commons/2/24/Nandinia_binotata%2C_Manchester_Museum.jpg,Wikimedia Commons,"The African palm civet, also known as the two-spotted palm civet, is a small feliform mammal widely distributed in sub-Saharan Africa. It is listed as least concern on the IUCN Red List. It is the sole member of the superfamily Nandinioidea and the most genetically isolated carnivoran."
Congo Basin,Red river hog,Red river hog,MAMMALIA,LC,Rainforest,https://upload.wikimedia.org/wikipedia/commons/4/44/Pinselohrschwein_Potamochoerus_porcus_Tierpark_Hellabrunn-5.jpg,Wikimedia Commons,"The red river hog or bushpig is a wild member of the pig family living in Africa, with most of its distribution in the Guinean and Congolian forests. It is rarely seen away from rainforests, and generally prefers areas near rivers or swamps."
Congo Basin,African dwarf crocodile,African dwarf crocodile,REPTILIA,VU,Forest streams,https://upload.wikimedia.org/wikipedia/commons/1/14/Crocodile_nain_aquarium_porte_dor%C3%A9e_Paris.JPG,Wikimedia Commons,"Osteolaemus is a genus of crocodiles. They are small, secretive crocodiles that occur in wetlands of West and Middle Africa. They are commonly known as the African dwarf crocodiles. Unlike other crocodiles, Osteolaemus are strictly nocturnal."
Congo Basin,African jacana,African jacana,AVES,LC,Flooded wetlands,https://upload.wikimedia.org/wikipedia/commons/7/76/African_jacana_actophilornis_africanus.jpg,Wikimedia Commons,"The African jacana is a wader in the family Jacanidae. It has long toes and long claws that enables it to walk on floating vegetation in shallow lakes, its preferred habitat. It is widely distributed in sub-Saharan Africa. For the origin and pronunciation of the name, see Jacanidae."
Congo Basin,Great blue turaco,Great blue turaco,AVES,LC,Rainforest canopy,https://upload.wikimedia.org/wikipedia/commons/7/70/017_Great_blue_turaco_at_Kibale_forest_National_Park_Photo_by_Giles_Laurent.jpg,Wikimedia Commons,"The great blue turaco is a bird species of the family Musophagidae. At 70–76 cm (28–30 in) in length, it is the largest species of turaco. It has predominantly grey-blue plumage with an upright blue-black crest around 10 cm (3.9 in) high. The male and female have similar plumage. It is widespread throughout the African tropical rainforest."
Congo Basin,Archispirostreptus gigas,Giant African millipede,INSECTA,LC,Forest floor,https://upload.wikimedia.org/wikipedia/commons/f/f5/Archispirostreptus-Gigas-Amphitheatre.jpg,Wikimedia Commons,"Archispirostreptus gigas, known as the giant African millipede, shongololo or Bongololo, is the largest extant species of millipede, growing up to 33.5 centimetres (13.2 in) in length, 67 millimetres (2.6 in) in circumference. It has approximately 256 legs, although the number of legs changes with each molting so it can vary according to each individual."
Congo Basin,Aucoumea klaineana,Okoumé,MAGNOLIOPSIDA,VU,Rainforest canopy,https://upload.wikimedia.org/wikipedia/commons/d/d1/MPADN0021.jpg,Wikimedia Commons,"Aucoumea klaineana is a tree in the family Burseraceae, native to equatorial west Africa in Gabon, the Republic of the Congo, and Río Muni. It is a large hardwood tree growing to 30–40 m tall, rarely larger, with a trunk 1.0–2.5 m diameter above the often large basal buttresses. The tree generally grows in small stands, with the roots of the trees intertwined with neighboring trees. In Gabon, it is the primary timber species."
Congo Basin,Milicia excelsa,African teak,MAGNOLIOPSIDA,NT,Rainforest canopy,https://upload.wikimedia.org/wikipedia/commons/f/f3/Milicia_roadside_small.jpg,Wikimedia Commons,"Milicia excelsa is a tree species from the genus Milicia of the family Moraceae. Distributed across tropical Central Africa, it is one of two species yielding timber commonly known as ọjị, African teak, iroko, intule, kambala, moreira, mvule, odum and tule. The tree has several medicinal applications and is considered sacred in parts of West Africa. It is currently listed as ""near-threatened"" by the International Union for Conservation of Nature."
Congo Basin,Entandrophragma cylindricum,Sapele,MAGNOLIOPSIDA,VU,Rainforest canopy,https://upload.wikimedia.org/wikipedia/commons/0/07/Sapele_Tree_Congo_Brazzaville.jpg,Wikimedia Commons,"Entandrophragma cylindricum is a tree of the genus Entandrophragma of the family Meliaceae. It is commonly known as sapele or sapelli or sapele mahogany, as well as aboudikro, assi, and muyovu."
Congo Basin,Raphia hookeri,Raffia palm,MAGNOLIOPSIDA,LC,Swamp forest,https://upload.wikimedia.org/wikipedia/commons/3/3e/Raphia_hookeri.jpg,Wikimedia Commons,"Raphia hookeri is a palm species in the family Arecaceae or Palmae. It is found in Western and Central Africa, where it is locally used to make palm wine. It is best noted for its very long leaflets which in the subspecies R. h. gigantea, of Ghana and Ivory Coast, can be 11 ft 6 in in length, while only two inches wide. These are the longest leaflets known from any plant."
Madagascar,Ring-tailed lemur,Ring-tailed lemur,MAMMALIA,EN,Dry forests,https://upload.wikimedia.org/wikipedia/commons/0/0b/Ring-tailed_lemur_%28Lemur_catta%29.jpg,Wikimedia Commons,"The ring-tailed lemur is a medium- to larger-sized strepsirrhine (wet-nosed) primate and the most internationally recognized lemur species, owing to its long, black-and-white, ringed tail. It belongs to Lemuridae, one of five lemur families, and is the only member of the Lemur genus. Like all lemurs, it is endemic to the island of Madagascar, where it is endangered. Known locally in Malagasy as maky or hira, it ranges from gallery forests to spiny scrub in the southern regions of the island. It is omnivorous, as well as the most adapted to living terrestrially of the extant lemurs."
Madagascar,Indri,Indri,MAMMALIA,EN,Eastern rainforests,https://upload.wikimedia.org/wikipedia/commons/0/0d/Indri_%28Indri_indri%29.jpg,Wikimedia Commons,"The indri, also called the babakoto, is one of the largest living lemurs, with a head-body length of about 64–72 cm and a weight of between 6 and 9.5 kg. It has a black and white coat and maintains an upright posture when climbing or clinging. It is monogamous and lives in small family groups, moving through the canopy, and is herbivorous, feeding mainly on leaves but also seeds, fruits, and flowers. The groups are quite vocal, communicating with other groups by singing, roaring and other vocalisations."
Madagascar,Aye-aye,Aye-aye,MAMMALIA,EN,Rainforest canopy,https://upload.wikimedia.org/wikipedia/commons/a/a2/Wild_aye_aye.jpg,Wikimedia Commons,"The aye-aye is a long-fingered lemur, a strepsirrhine primate native to Madagascar with rodent-like teeth that perpetually grow and a special thin middle finger that they can use to catch grubs and larvae out of tree trunks."
Madagascar,Fossa,Fossa,MAMMALIA,VU,Forest interior,https://upload.wikimedia.org/wikipedia/en/5/5f/Disambig_gray.svg,Wikimedia Commons,Fossa may refer to:
Madagascar,Madagascar hissing cockroach,Madagascar hissing cockroach,INSECTA,LC,Forest floor,https://upload.wikimedia.org/wikipedia/commons/4/46/Female_Madagascar_hissing_cockroach.JPG,Wikimedia Commons,"The Madagascar hissing cockroach, also known as the hissing cockroach or simply hisser, is one of the largest species of cockroach, reaching 5 to 7.5 centimetres at maturity. They are native to the island of Madagascar, which is off the African mainland, where they are commonly found in rotting logs. It is one of some 20 known species of large hissing roaches from Madagascar, many of which are kept as pets, and often confused with one another by pet dealers; in particular, G. portentosa is commonly confused with G. oblongonota and G. picea."
